Hero Name,Real Name,Role / Archetype,Super Powers,Weaknesses,Costume / Visuals,Signature Move,Picture Link,Uploaded Sketch,Universe
CIPHER,Paige ,Tech,Digital Omniscience: Hacks any camera/mic; controls traffic & grids; erases digital footprints.,No Signal: Powerless in Faraday cages/dead zones. Social Battery: Drains fast in crowds.,"Black tech-wear hoodie, cargo pants, combat boots, asymmetrical headset with holo-monocle.","""The Ghost Protocol"": Erases team from all digital feeds instantly.",cipher.png,,Home
SKETCH,Joe Taylor ,Main Character / The Visionary,"Living Sketchbook: Drawings become real 3D objects (bridges, cages, ladders).",Imposter Syndrome: Constructs crumble if he loses confidence. Water: Ink dissolves in rain.,"Red zip-up hoodie, messy hair, glowing stylus behind ear, ink-stained hands.",""" The Finisher"": Draws a massive solution (rocket, net) to end the fight.",sketch.png,,Home
COUNTER,Maya Taylor ,The Reluctant Hero / Tactical Support,Calculated Trajectory: Redirects attacks with 100% accuracy. Audit Vision: Sees mathematical weak points.,The Nixon Distraction: Freezes if BF texts. Teenage Priorities: Will leave fight for a date.,Volleyball uniform (spandex/knee pads) with a professional blazer. Dark rimmed glasses.,"""The Return to Sender"": Catches a projectile and spikes it back at double speed.",counter.png,,Home
REDLINE,Abbie Taylor ,The Enforcer / Driver,Velocity Strength: Invulnerable & super strong only when moving. Vehicle Mastery: Pushes cars beyond limits.,Idle Speed: Weak if forced to stand still. Road Rage: Loses focus if she sees bullies.,"Black leather racing jacket, skinny jeans, helmet, wields a tire iron.",""" The Pit Maneuver"": Slams into enemy at high speed to shatter their defense.",redline.png,,Home
AMP,Waylon Taylor ,The Hype Man / Crowd Control,Sonic Resonance: Claps/stomps create concussive blasts. Vibe Check: Tracks enemies through walls via sound.,Volume Control: Accidentally breaks own team's gear. The Permit: Can't legally drive.,"Baggy jeans, Nikes, oversized hoodie with band logo, massive headphones around neck.","""The Bass Drop"": A massive stomp that knocks back all enemies in radius.",amp.png,,Home
Slick Nix,Nixon ,The Boyfriend / The Enigma,Suspiciously Polite: Deflects all interrogation. The Ghost: Vanishes when adults appear.,Family Trust: The Dad (Jeremy) and Uncle (Luke) actively distrust him.,"Oversized hoodies (hood up), shaggy hair, always holding a small gift box.","""The Subject Change"": Avoids a direct question with a perfect compliment.",slick_nix.png,,Home
SUPER LUKE,Luke Taylor,Team Leader / The Tank,"Viscosity Manipulation: Hardens liquid ""paint"" armor. Roller Staff: Creates walls/barriers.",Solvents: Paint thinner dissolves armor. Chocolate: Makes armor soft/tacky. Bad Back: L4 vertebrae pain.,"White fireproof painter overalls, respirator mask, safety goggles, utility belt.","""The Final Coat"": Floods area with sludge that hardens, freezing everyone.",super_luke.png,,Home
NANA THE GREAT,Helen Simons,The Matriarch / Healer,Domestic Force: Indestructible energy shields. Omega Spoon: Hits like a truck. Cookies: Heals injuries.,BOGO Sales: Distracted by discounts. Soap Operas: Unavailable 1-2pm. Bedtime: weak after 8:30pm.,"Navy blue tactical scrubs with daisy print, steel-wool knit shawl, rocket-heeled nursing shoes.","""The Time-Out"": Traps villain in a sound-proof energy playpen.",super_nana.png,,Home
MEGAWATT,Jeremy Taylor,The Engineer / Blaster,Living Capacitor: Absorbs/shoots electricity. Schematic Vision: Sees wiring in walls/robots.,"Insulation: Rubber blocks powers. Frugality: Hates wasting ""expensive"" energy.","High-vis vest, orange work pants, hard hat with lamp, thick rubber lineman gloves.","""The Blackout"": Drains neighborhood power for one massive flashbang blast.",MEGAWATT.png,,Home